{"$schema":"https://json-schema.org/draft/2020-12/schema","type":"object","additionalProperties":false,"required":["queue_id","selection_method","records","prohibited_next_step","next_permitted_action"],"properties":{"queue_id":{"const":"system-one-seed-queue-1"},"selection_method":{"const":"design-pattern-first"},"records":{"type":"array","minItems":5,"maxItems":8,"items":{"type":"object","additionalProperties":false,"required":["seed_id","pattern_id","primary_url","official_record_url","pre_admission_status"],"properties":{"seed_id":{"pattern":"^seed-","type":"string"},"pattern_id":{"pattern":"^seed-pattern-","type":"string"},"primary_url":{"format":"uri","type":"string"},"official_record_url":{"format":"uri","type":"string"},"pre_admission_status":{"const":"evidence-pending-not-full-audit"}}}},"prohibited_next_step":{"minLength":30,"type":"string"},"next_permitted_action":{"minLength":30,"type":"string"}}}
