{"queue_id":"system-one-seed-queue-1","selection_method":"design-pattern-first","records":[{"seed_id":"seed-locomotor-repeatability","pattern_id":"seed-pattern-within-between-repeated-unit","primary_url":"https://doi.org/10.1242/jeb.141259","official_record_url":"https://zenodo.org/records/5000340","pre_admission_status":"evidence-pending-not-full-audit"},{"seed_id":"seed-replicated-time-series","pattern_id":"seed-pattern-replicated-baseline-change","primary_url":"https://doi.org/10.1038/hdy.2016.98","official_record_url":"https://zenodo.org/records/4991393","pre_admission_status":"evidence-pending-not-full-audit"},{"seed_id":"seed-growth-trajectory-missingness","pattern_id":"seed-pattern-within-between-repeated-unit","primary_url":"https://doi.org/10.1086/692797","official_record_url":"https://zenodo.org/records/4992283","pre_admission_status":"evidence-pending-not-full-audit"},{"seed_id":"seed-predator-response-synthesis","pattern_id":"seed-pattern-evidence-table-reconciliation","primary_url":"https://doi.org/10.1098/rspb.2018.0857","official_record_url":"https://zenodo.org/records/5002828","pre_admission_status":"evidence-pending-not-full-audit"},{"seed_id":"seed-home-range-calibration","pattern_id":"seed-pattern-calibration-condition-shift","primary_url":"https://doi.org/10.1111/2041-210X.13270","official_record_url":"https://zenodo.org/records/4976491","pre_admission_status":"evidence-pending-not-full-audit"}],"prohibited_next_step":"Do not perform source-and-fragility full audit, candidate construction, or System-2 shadow review for a queued source.","next_permitted_action":"For each source, collect pre-admission evidence for all seven conditions; retain a failed condition as a rejection receipt and full-audit only a complete seed."}
